{
  "$schema": "http://json-schema.org/draft-07/schema#",
  "title": "OpenGuidePlatform coordinated release lock v1",
  "type": "object",
  "additionalProperties": false,
  "properties": {
    "schemaVersion": {
      "const": 1
    },
    "version": {
      "type": "string",
      "pattern": "^v?[0-9]+\\.[0-9]+\\.[0-9]+(?:-[0-9A-Za-z.-]+)?(?:\\+[0-9A-Za-z.-]+)?$"
    },
    "channel": {
      "enum": [
        "preview",
        "stable"
      ]
    },
    "sourceCommit": {
      "type": "string",
      "pattern": "^[0-9a-f]{40}$"
    },
    "package": {
      "type": "object",
      "additionalProperties": false,
      "properties": {
        "url": {
          "type": "string",
          "pattern": "^https://"
        },
        "sha256": {
          "type": "string",
          "pattern": "^[0-9a-f]{64}$"
        }
      },
      "required": [
        "url",
        "sha256"
      ]
    },
    "hugoModule": {
      "type": "object",
      "additionalProperties": false,
      "properties": {
        "path": {
          "type": "string",
          "minLength": 1
        },
        "version": {
          "type": "string",
          "pattern": "^v?[0-9]+\\.[0-9]+\\.[0-9]+(?:-[0-9A-Za-z.-]+)?(?:\\+[0-9A-Za-z.-]+)?$"
        }
      },
      "required": [
        "path",
        "version"
      ]
    },
    "workflow": {
      "type": "object",
      "additionalProperties": false,
      "properties": {
        "repository": {
          "type": "string",
          "pattern": "^[^/]+/[^/]+$"
        },
        "path": {
          "type": "string",
          "minLength": 1,
          "pattern": "^(?!/)(?!.*(?:^|/)\\.\\.(?:/|$))(?!.*[\\\\:]).+$"
        },
        "commit": {
          "type": "string",
          "pattern": "^[0-9a-f]{40}$"
        },
        "version": {
          "type": "string",
          "pattern": "^v[0-9]+(?:\\.[0-9]+){0,2}(?:-[0-9A-Za-z.-]+)?$"
        }
      },
      "required": [
        "repository",
        "path",
        "commit",
        "version"
      ]
    },
    "components": {
      "type": "object",
      "additionalProperties": false,
      "properties": {
        "Hugo.Guides": {
          "type": "string",
          "pattern": "^v?[0-9]+\\.[0-9]+\\.[0-9]+(?:-[0-9A-Za-z.-]+)?(?:\\+[0-9A-Za-z.-]+)?$"
        },
        "PowerShell.Core": {
          "type": "string",
          "pattern": "^v?[0-9]+\\.[0-9]+\\.[0-9]+(?:-[0-9A-Za-z.-]+)?(?:\\+[0-9A-Za-z.-]+)?$"
        },
        "PowerShell.Build": {
          "type": "string",
          "pattern": "^v?[0-9]+\\.[0-9]+\\.[0-9]+(?:-[0-9A-Za-z.-]+)?(?:\\+[0-9A-Za-z.-]+)?$"
        },
        "AgentSkills": {
          "type": "string",
          "pattern": "^v?[0-9]+\\.[0-9]+\\.[0-9]+(?:-[0-9A-Za-z.-]+)?(?:\\+[0-9A-Za-z.-]+)?$"
        },
        "AgentControls": {
          "type": "string",
          "pattern": "^v?[0-9]+\\.[0-9]+\\.[0-9]+(?:-[0-9A-Za-z.-]+)?(?:\\+[0-9A-Za-z.-]+)?$"
        }
      },
      "required": [
        "Hugo.Guides",
        "PowerShell.Core",
        "PowerShell.Build",
        "AgentSkills",
        "AgentControls"
      ]
    },
    "toolchain": {
      "type": "object",
      "additionalProperties": false,
      "properties": {
        "hugo": {
          "type": "string",
          "pattern": "^v?[0-9]+\\.[0-9]+\\.[0-9]+(?:-[0-9A-Za-z.-]+)?(?:\\+[0-9A-Za-z.-]+)?$"
        },
        "powerShell": {
          "type": "string",
          "pattern": "^v?[0-9]+\\.[0-9]+\\.[0-9]+(?:-[0-9A-Za-z.-]+)?(?:\\+[0-9A-Za-z.-]+)?$"
        },
        "go": {
          "type": "string",
          "pattern": "^v?[0-9]+\\.[0-9]+\\.[0-9]+(?:-[0-9A-Za-z.-]+)?(?:\\+[0-9A-Za-z.-]+)?$"
        }
      },
      "required": [
        "hugo",
        "powerShell",
        "go"
      ]
    }
  },
  "required": [
    "schemaVersion",
    "version",
    "channel",
    "sourceCommit",
    "package",
    "hugoModule",
    "workflow",
    "components",
    "toolchain"
  ]
}